internal_location,md5,md5short,ksize,moltype,num,scaled,n_hashes,with_abundance,name,filename
signatures/2a1c46ae71c8281c1b654930f9d8dcd1.sig.gz,2a1c46ae71c8281c1b654930f9d8dcd1,2a1c46ae,31,DNA,0,1000,4798,True,"GCF_001481135.1 Salmonella enterica subsp. enterica serovar Muenchen strain=CVM N42479, Salmonella enterica CVM N42479 v1.0",/dev/fd/63
signatures/da3061ec62022cac68628ce1ad0557e7.sig.gz,da3061ec62022cac68628ce1ad0557e7,da3061ec,31,DNA,0,1000,2247,True,"GCF_001117045.1 Streptococcus pneumoniae strain=29_PMEN2, 5901_7#9",/dev/fd/63
signatures/9530dd24bba895c1b6222e86fc0e808b.sig.gz,9530dd24bba895c1b6222e86fc0e808b,9530dd24,31,DNA,0,1000,4806,True,"GCF_004284445.1 Escherichia coli strain=EC_36, ASM428444v1",/dev/fd/63
signatures/39c795d304a5924709d545a8bf4ca101.sig.gz,39c795d304a5924709d545a8bf4ca101,39c795d3,31,DNA,0,1000,4352,True,"GCF_001256755.1 Shigella sonnei strain=SS117077_2798526, 6551_1#4",/dev/fd/63
signatures/96dfccfea7d4b76c2255bfaba57a2756.sig.gz,96dfccfea7d4b76c2255bfaba57a2756,96dfccfe,31,DNA,0,1000,3977,True,"GCF_002098515.1 Vibrio cholerae strain=CISM_154, ASM209851v1",/dev/fd/63
signatures/fbd5ebbcca1765ea1fbccb5dfc445afa.sig.gz,fbd5ebbcca1765ea1fbccb5dfc445afa,fbd5ebbc,31,DNA,0,1000,1010,True,"GCA_905182235.1 SAR86 cluster bacterium SAR86B, FRAM18_bin302",/dev/fd/63
signatures/cc42e25496237095a8176b7b1f51fe6e.sig.gz,cc42e25496237095a8176b7b1f51fe6e,cc42e254,31,DNA,0,1000,5932,True,"GCF_002566325.1 Bacillus thuringiensis strain=AFS082247, ASM256632v1",/dev/fd/63
signatures/25617035e55c90c7d0fdb1deb31d3dee.sig.gz,25617035e55c90c7d0fdb1deb31d3dee,25617035,31,DNA,0,1000,1510,True,"GCF_000165615.1 Gardnerella vaginalis 101 strain=101, ASM16561v2",/dev/fd/63
signatures/069c3c334626c2e0b434e70e413be128.sig.gz,069c3c334626c2e0b434e70e413be128,069c3c33,31,DNA,0,1000,7022,True,"GCF_001451965.1 Pseudomonas aeruginosa strain=WH-SGI-V-07619, WH-SGI-V-07619",/dev/fd/63
signatures/6eabe6994524ce272a9708e124ad7583.sig.gz,6eabe6994524ce272a9708e124ad7583,6eabe699,31,DNA,0,1000,4536,True,"GCF_005938275.1 Salmonella enterica subsp. enterica serovar Heidelberg strain=SE715, ASM593827v1",/dev/fd/63
signatures/4b459f009a068042a3f774aebf48ac50.sig.gz,4b459f009a068042a3f774aebf48ac50,4b459f00,31,DNA,0,1000,4962,True,"GCF_013411395.1 Salmonella enterica subsp. enterica serovar Typhimurium strain=RT323, ASM1341139v1",/dev/fd/63
signatures/aadc6dc1d7dda9f80d951137aa41b841.sig.gz,aadc6dc1d7dda9f80d951137aa41b841,aadc6dc1,31,DNA,0,1000,6734,True,"GCF_900099905.1 Mesorhizobium muleiense strain=CGMCC 1.11022, IMG-taxon 2675903064 annotated assembly",/dev/fd/63
signatures/26a8c20992798313fafe7322eada3987.sig.gz,26a8c20992798313fafe7322eada3987,26a8c209,31,DNA,0,1000,1218,True,"GCA_902644635.1 uncultured Wolbachia sp., WOLB0800",/dev/fd/63
signatures/d1d8261022ee8a83e7803c00341f448c.sig.gz,d1d8261022ee8a83e7803c00341f448c,d1d82610,31,DNA,0,1000,2802,True,"GCF_001018975.2 Staphylococcus aureus strain=FDAARGOS_30, ASM101897v2",/dev/fd/63
signatures/377bb6dc86899c0ffe011cafdafd2952.sig.gz,377bb6dc86899c0ffe011cafdafd2952,377bb6dc,31,DNA,0,1000,2755,True,"GCF_003579145.1 Staphylococcus xylosus strain=SNUC 5740, ASM357914v1",/dev/fd/63
signatures/1d92fe874d6415a5a9ce58b22b7d225b.sig.gz,1d92fe874d6415a5a9ce58b22b7d225b,1d92fe87,31,DNA,0,1000,982,True,"GCF_000441675.1 Chlamydia trachomatis RC-J/953 strain=RC-J/953, ASM44167v1",/dev/fd/63
signatures/b5521dc9bd6b6d615c4b1431f08d814d.sig.gz,b5521dc9bd6b6d615c4b1431f08d814d,b5521dc9,31,DNA,0,1000,4337,True,"GCF_001851925.1 Mycobacterium tuberculosis strain=02-R1589, ASM185192v1",/dev/fd/63
signatures/04a48b6f7dddb393a1e408b1a8aa90de.sig.gz,04a48b6f7dddb393a1e408b1a8aa90de,04a48b6f,31,DNA,0,1000,2809,True,"GCF_900107035.1 Alicyclobacillus hesperidum strain=DSM 12489, IMG-taxon 2634166329 annotated assembly",/dev/fd/63
signatures/346ec01f8e061c536d72b9bd13251382.sig.gz,346ec01f8e061c536d72b9bd13251382,346ec01f,31,DNA,0,1000,3235,True,"GCA_903834745.1 uncultured proteobacterium, freshwater MAG --- LaPlata-b_bin-0184",/dev/fd/63
signatures/e48376c5c96b072416ccc6627cf72bc2.sig.gz,e48376c5c96b072416ccc6627cf72bc2,e48376c5,31,DNA,0,1000,1407,True,"GCA_017531525.1 Tidjanibacter sp., ASM1753152v1",/dev/fd/63
signatures/1e33f038a7d8a9a4df156c4ba4768354.sig.gz,1e33f038a7d8a9a4df156c4ba4768354,1e33f038,31,DNA,0,1000,4023,True,"GCF_015265435.1 Alcanivorax sp. ST75FaO-1 strain=ST75FaO-1, ASM1526543v1",/dev/fd/63
signatures/3e5ed13316c5f4ffa32b96d8bf84a4f5.sig.gz,3e5ed13316c5f4ffa32b96d8bf84a4f5,3e5ed133,31,DNA,0,1000,4545,True,"GCA_018588645.1 Shigella flexneri, ASM1858864v1",/dev/fd/63
signatures/677e4f85f3bca709c19700b5ba5f49f2.sig.gz,677e4f85f3bca709c19700b5ba5f49f2,677e4f85,31,DNA,0,1000,2035,True,"GCF_001173925.1 Streptococcus pneumoniae strain=SMRU1393, 6710_8#1",/dev/fd/63
signatures/26ac8745b3c62d688c25337fd8ae75c8.sig.gz,26ac8745b3c62d688c25337fd8ae75c8,26ac8745,31,DNA,0,1000,2550,True,"GCF_900129265.1 Caloramator proteoclasticus DSM 10124 strain=DSM 10124, IMG-taxon 2582581267 annotated assembly",/dev/fd/63
signatures/5f79f33132ea4cd9ae29552c873d5443.sig.gz,5f79f33132ea4cd9ae29552c873d5443,5f79f331,31,DNA,0,1000,4280,True,"GCF_011044255.1 Sphingomonas sp. MK52 strain=MK52, ASM1104425v1",/dev/fd/63
signatures/ada47554acc7983eb5f8d9ec23aeb121.sig.gz,ada47554acc7983eb5f8d9ec23aeb121,ada47554,31,DNA,0,1000,4421,True,"GCF_900485925.1 Shigella flexneri strain=4028STDY6275097, 18787_5#85",/dev/fd/63
signatures/dc0d4c7d06a6159a8c1978eb2ce7ecd9.sig.gz,dc0d4c7d06a6159a8c1978eb2ce7ecd9,dc0d4c7d,31,DNA,0,1000,4667,True,"GCF_014354205.1 Pantoea eucalypti strain=Pv21-6, ASM1435420v1",/dev/fd/63
signatures/a0a20a1ff41e8808710acda82c760d54.sig.gz,a0a20a1ff41e8808710acda82c760d54,a0a20a1f,31,DNA,0,1000,4309,True,"GCA_002377205.1 Pseudomonas stutzeri, ASM237720v1",/dev/fd/63
signatures/5b016a511cca102bb92ad94f28700e13.sig.gz,5b016a511cca102bb92ad94f28700e13,5b016a51,31,DNA,0,1000,1651,True,"GCA_003661385.1 Candidatus Korarchaeota archaeon, ASM366138v1",/dev/fd/63
signatures/2f1771969a31e437917435dd81ae6b2c.sig.gz,2f1771969a31e437917435dd81ae6b2c,2f177196,31,DNA,0,1000,5513,True,"GCF_013317565.1 Agrobacterium tumefaciens strain=T90/95, ASM1331756v1",/dev/fd/63
signatures/1b3c4983632fe246021195c18946371b.sig.gz,1b3c4983632fe246021195c18946371b,1b3c4983,31,DNA,0,1000,5064,True,"GCF_900142445.1 Chryseobacterium polytrichastri strain=DSM 26899, IMG-taxon 2700988715 annotated assembly",/dev/fd/63
signatures/6f3eba88a1af8736d5020064279f85b8.sig.gz,6f3eba88a1af8736d5020064279f85b8,6f3eba88,31,DNA,0,1000,2891,True,"GCF_002885235.1 Akkermansia muciniphila strain=GP21, ASM288523v1",/dev/fd/63
signatures/1608fbbc7df9a82bbd3f854bf8611fcb.sig.gz,1608fbbc7df9a82bbd3f854bf8611fcb,1608fbbc,31,DNA,0,1000,5045,True,"GCF_001215585.1 Salmonella enterica subsp. enterica serovar Typhimurium str. DT104 strain=H77, 5295_2#8",/dev/fd/63
signatures/5d11e74c499f453f75b82f39108c1177.sig.gz,5d11e74c499f453f75b82f39108c1177,5d11e74c,31,DNA,0,1000,5090,True,"GCF_003317255.1 Escherichia coli strain=CVAST2552, ASM331725v1",/dev/fd/63
signatures/f48089c94b7ec72a8e1af4781d857742.sig.gz,f48089c94b7ec72a8e1af4781d857742,f48089c9,31,DNA,0,1000,7237,True,"GCF_001524805.1 Burkholderia ubonensis strain=MSMB2037, ASM152480v1",/dev/fd/63
signatures/35b7a89ae2e11e0d723b98e695456f5f.sig.gz,35b7a89ae2e11e0d723b98e695456f5f,35b7a89a,31,DNA,0,1000,4032,True,"GCF_902703115.1 Acinetobacter baumannii strain=Aci00882, Aci00882",/dev/fd/63
signatures/1cb8be4e8f965f9b6f92ce13fdd1ac0c.sig.gz,1cb8be4e8f965f9b6f92ce13fdd1ac0c,1cb8be4e,31,DNA,0,1000,2288,True,"GCA_003693905.1 Alphaproteobacteria bacterium, ASM369390v1",/dev/fd/63
signatures/52aebfe21f07c0379019e9cf468e119a.sig.gz,52aebfe21f07c0379019e9cf468e119a,52aebfe2,31,DNA,0,1000,2431,True,"GCA_002067795.1 Methanosaeta sp. PtaB.Bin039, ASM206779v1",/dev/fd/63
signatures/58ba1225e6d2185effc8ae6fd0ffd03a.sig.gz_0,58ba1225e6d2185effc8ae6fd0ffd03a,58ba1225,31,DNA,0,1000,2143,True,"GCF_009916665.1 Streptococcus equi strain=17-009, ASM991666v1",/dev/fd/63
signatures/8895c3cf0d54b003969f7b2f448604dd.sig.gz,8895c3cf0d54b003969f7b2f448604dd,8895c3cf,31,DNA,0,1000,1069,True,"GCA_014132315.1 Rickettsiales bacterium strain=Sesoko1, ASM1413231v1",/dev/fd/63
signatures/11379a7de49a3a2b055fda8b46b89f8c.sig.gz,11379a7de49a3a2b055fda8b46b89f8c,11379a7d,31,DNA,0,1000,2915,True,"GCF_015352495.1 Listeria monocytogenes strain=LM19_85, ASM1535249v1",/dev/fd/63
signatures/378400e68702dc9b87010883562bdfd9.sig.gz,378400e68702dc9b87010883562bdfd9,378400e6,31,DNA,0,1000,2761,True,"GCF_003422965.1 Staphylococcus aureus strain=M6K206, ASM342296v1",/dev/fd/63
signatures/4ea438bad4e63cec73a6685864ab0187.sig.gz,4ea438bad4e63cec73a6685864ab0187,4ea438ba,31,DNA,0,1000,5432,True,"GCF_001557375.1 Phenylobacterium sp. CCH12-B4 strain=CCH12-B4, ASM155737v1",/dev/fd/63
signatures/793e249688bc55f759968ffd57c75d5d.sig.gz,793e249688bc55f759968ffd57c75d5d,793e2496,31,DNA,0,1000,5272,True,"GCF_016653075.1 Escherichia coli strain=EC274_ST38H, ASM1665307v1",/dev/fd/63
signatures/ebb7e8ebf1a7f1016eaf2f323d5cc02b.sig.gz,ebb7e8ebf1a7f1016eaf2f323d5cc02b,ebb7e8eb,31,DNA,0,1000,6856,True,"GCF_003410645.2 Pseudomonas aeruginosa strain=PABL089, ASM341064v2",/dev/fd/63
signatures/3996c9fdf3cf4397e0a380e0251e16d1.sig.gz,3996c9fdf3cf4397e0a380e0251e16d1,3996c9fd,31,DNA,0,1000,5845,True,"GCF_008692875.1 Pseudomonas cannabina strain=CCUG 51523T, ASM869287v1",/dev/fd/63
signatures/eee26df03a6841c4433e9f0e0675d14c.sig.gz,eee26df03a6841c4433e9f0e0675d14c,eee26df0,31,DNA,0,1000,5108,True,"GCF_001877805.1 Escherichia coli strain=SF-452, ASM187780v1",/dev/fd/63
signatures/14f238d18c273876d92f75c75780450d.sig.gz,14f238d18c273876d92f75c75780450d,14f238d1,31,DNA,0,1000,6914,True,"GCF_003835765.1 Pseudomonas aeruginosa strain=DUN-007-2, ASM383576v1",/dev/fd/63
signatures/a409d2fec12e3e746ff09ada000a9b52.sig.gz,a409d2fec12e3e746ff09ada000a9b52,a409d2fe,31,DNA,0,1000,3403,True,"GCA_003464935.1 [Eubacterium] rectale strain=AF12-8, ASM346493v1",/dev/fd/63
signatures/d19ab56aeaa76c06b355469b31768f89.sig.gz,d19ab56aeaa76c06b355469b31768f89,d19ab56a,31,DNA,0,1000,4667,True,"GCF_002899895.1 Chryseobacterium oncorhynchi strain=701B-08, ASM289989v2",/dev/fd/63
signatures/deb980f7553d8934239bc32a1e38355d.sig.gz,deb980f7553d8934239bc32a1e38355d,deb980f7,31,DNA,0,1000,2773,True,"GCF_008270065.1 Listeria monocytogenes strain=IN-RH-4-BL1, ASM827006v1",/dev/fd/63
signatures/842623e745f2a0614a286ece47e75cf4.sig.gz,842623e745f2a0614a286ece47e75cf4,842623e7,31,DNA,0,1000,3018,True,"GCF_003965915.1 Listeria monocytogenes strain=R6, ASM396591v1",/dev/fd/63
signatures/a17f34e5ad4526b9d385db2eec1609eb.sig.gz,a17f34e5ad4526b9d385db2eec1609eb,a17f34e5,31,DNA,0,1000,1703,True,"GCA_903939265.1 uncultured Solirubrobacterales bacterium, freshwater MAG --- Loc090116-4m_bin-0830",/dev/fd/63
signatures/32c60e5f19416c75b3272dee6d300e94.sig.gz,32c60e5f19416c75b3272dee6d300e94,32c60e5f,31,DNA,0,1000,2099,True,"GCA_001051075.1 Riemerella anatipestifer strain=17, ASM105107v1",/dev/fd/63
signatures/a50c673f79ccd4301c0efc55d4de90db.sig.gz,a50c673f79ccd4301c0efc55d4de90db,a50c673f,31,DNA,0,1000,2786,True,"GCA_002389475.1 Flavobacteriales bacterium UBA4454, ASM238947v1",/dev/fd/63
signatures/6b3f35eacd65f8351ee72a8e670b4e0d.sig.gz,6b3f35eacd65f8351ee72a8e670b4e0d,6b3f35ea,31,DNA,0,1000,1511,True,"GCA_002404865.1 Bacillales bacterium UBA4691, ASM240486v1",/dev/fd/63
signatures/e69e99ab711b4334d2e460e86c69a887.sig.gz,e69e99ab711b4334d2e460e86c69a887,e69e99ab,31,DNA,0,1000,6783,True,"GCA_900473045.1 Rhizobiales bacterium, AFS094519",/dev/fd/63
signatures/2aa32f729cc5dea7205d44e46cce9b73.sig.gz,2aa32f729cc5dea7205d44e46cce9b73,2aa32f72,31,DNA,0,1000,5736,True,"GCF_002561575.1 Bacillus cereus strain=AFS014679, ASM256157v1",/dev/fd/63
signatures/1ee6ecd957d6906c0eab64add7ce5ac7.sig.gz_1,1ee6ecd957d6906c0eab64add7ce5ac7,1ee6ecd9,31,DNA,0,1000,4461,True,"GCF_001309185.1 Cronobacter sakazakii strain=715, ASM130918v1",/dev/fd/63
signatures/ae005057ad1eca1fb7a755b751b56aa1.sig.gz,ae005057ad1eca1fb7a755b751b56aa1,ae005057,31,DNA,0,1000,2008,True,"GCA_017882555.1 Thermoleophilia bacterium, ASM1788255v1",/dev/fd/63
signatures/f2e4982f990494dbfd8e130dd7f44598.sig.gz,f2e4982f990494dbfd8e130dd7f44598,f2e4982f,31,DNA,0,1000,2007,True,"GCF_000311485.1 Streptococcus agalactiae FSL S3-137 strain=FSL S3-137, ASM31148v1",/dev/fd/63
signatures/dff9f267477b6f6067c03334ec06c31b.sig.gz,dff9f267477b6f6067c03334ec06c31b,dff9f267,31,DNA,0,1000,3684,True,"GCF_900058555.1 Legionella pneumophila strain=2531STDY5467379, 10771_3#2",/dev/fd/63
signatures/515b3e4da0d85d3289d4002b378d384c.sig.gz,515b3e4da0d85d3289d4002b378d384c,515b3e4d,31,DNA,0,1000,4715,True,"GCF_001900695.1 Escherichia coli strain=D6, ASM190069v1",/dev/fd/63
signatures/fa0dd31654ba4f81e7e5d3953b99e96b.sig.gz,fa0dd31654ba4f81e7e5d3953b99e96b,fa0dd316,31,DNA,0,1000,8337,True,"GCF_902500395.1 Burkholderia cenocepacia strain=BCC0132, Burkholderia contaminans LMG 31806 assembly",/dev/fd/63
signatures/36095926610f9e2f1c9f508ce5193ba3.sig.gz,36095926610f9e2f1c9f508ce5193ba3,36095926,31,DNA,0,1000,2881,True,"GCA_004102765.1 Muribaculaceae bacterium Isolate-004 (NCI) strain=Isolate-004 (NCI), ASM410276v1",/dev/fd/63
signatures/d014d8736531e5be46d1464eb4df7da0.sig.gz,d014d8736531e5be46d1464eb4df7da0,d014d873,31,DNA,0,1000,7019,True,"GCF_002981575.1 Burkholderia vietnamiensis strain=AU3578, ASM298157v1",/dev/fd/63
signatures/35cca9f611a3a96aec5f5f9498341cc4.sig.gz,35cca9f611a3a96aec5f5f9498341cc4,35cca9f6,31,DNA,0,1000,1836,True,"GCF_002966715.1 Haemophilus influenzae strain=6P32H1, ASM296671v1",/dev/fd/63
signatures/09c13755eaf5db4422a6f03e9359746b.sig.gz,09c13755eaf5db4422a6f03e9359746b,09c13755,31,DNA,0,1000,4209,True,"GCF_016729435.1 Aeromonas caviae strain=CN17A0095, ASM1672943v1",/dev/fd/63
signatures/74ec8ee01a7d86ad95c217f76efc1dc9.sig.gz,74ec8ee01a7d86ad95c217f76efc1dc9,74ec8ee0,31,DNA,0,1000,1659,True,"GCF_001291965.1 Campylobacter jejuni strain=12502, 12502_S52contigs.fa",/dev/fd/63
signatures/95bcec0961408bc359d9e1fbcb9ff7c5.sig.gz,95bcec0961408bc359d9e1fbcb9ff7c5,95bcec09,31,DNA,0,1000,4034,True,"GCF_002301465.1 Clostridioides difficile strain=5544-AH/ST67, ASM230146v1",/dev/fd/63
signatures/3b77fe23a11ad1a6b4f11acf8fa64ddf.sig.gz,3b77fe23a11ad1a6b4f11acf8fa64ddf,3b77fe23,31,DNA,0,1000,2452,True,"GCF_003035425.1 Staphylococcus epidermidis strain=SNUC 29, ASM303542v1",/dev/fd/63
signatures/b529cfca24cfaa58752ef7c8f791f28b.sig.gz,b529cfca24cfaa58752ef7c8f791f28b,b529cfca,31,DNA,0,1000,6569,True,"GCF_002813455.1 Pseudomonas baetica strain=LMG 25716, ASM281345v1",/dev/fd/63
signatures/7e04abb82a7b373a662fff05babd742c.sig.gz,7e04abb82a7b373a662fff05babd742c,7e04abb8,31,DNA,0,1000,5522,True,"GCA_900016125.1 Escherichia coli strain=EF467, EF467_contigs",/dev/fd/63
signatures/4c6f87225a56057972b9fee8b273596f.sig.gz,4c6f87225a56057972b9fee8b273596f,4c6f8722,31,DNA,0,1000,4941,True,"GCF_002105815.1 Salmonella enterica subsp. enterica serovar Copenhagen strain=NY_FSL C7-1193, ASM210581v1",/dev/fd/63
signatures/3c01ad91941637e5d89d8f0cafb7f04f.sig.gz,3c01ad91941637e5d89d8f0cafb7f04f,3c01ad91,31,DNA,0,1000,5039,True,"GCF_900141235.1 Mycobacteroides abscessus subsp. abscessus strain=702, 10702_1#87",/dev/fd/63
signatures/5562f5d876035648ed5462b2485970d1.sig.gz,5562f5d876035648ed5462b2485970d1,5562f5d8,31,DNA,0,1000,2079,True,"GCA_009917805.1 Verrucomicrobia bacterium, ASM991780v1",/dev/fd/63
signatures/ab9aaf316e3e4a02171e436725507d0c.sig.gz,ab9aaf316e3e4a02171e436725507d0c,ab9aaf31,31,DNA,0,1000,573,True,"GCA_903828465.1 uncultured Candidatus Saccharibacteria bacterium, freshwater MAG --- Umea3_bin-2596",/dev/fd/63
signatures/68d0afd3e4abae00441229bdabf1c229.sig.gz,68d0afd3e4abae00441229bdabf1c229,68d0afd3,31,DNA,0,1000,1881,True,"GCA_018066905.1 Paraperlucidibaca sp., ASM1806690v1",/dev/fd/63
signatures/aa9eede3f5dba3d7605dceeea61427a6.sig.gz,aa9eede3f5dba3d7605dceeea61427a6,aa9eede3,31,DNA,0,1000,1897,True,"GCA_011361995.1 Synergistetes bacterium, ASM1136199v1",/dev/fd/63
signatures/8e6e2d1ed58548c34abcf95da2a08901.sig.gz,8e6e2d1ed58548c34abcf95da2a08901,8e6e2d1e,31,DNA,0,1000,1623,True,"GCA_001767885.1 Alphaproteobacteria bacterium RIFCSPHIGHO2_02_FULL_42_30, ASM176788v1",/dev/fd/63
signatures/ac926f6d06c0d7ada7a7221407e0da19.sig.gz,ac926f6d06c0d7ada7a7221407e0da19,ac926f6d,31,DNA,0,1000,4848,True,"GCF_900480205.1 Escherichia coli strain=VREC0563, 17328_2#35",/dev/fd/63
signatures/8f25860e9b0652e5087cf5b96909376a.sig.gz,8f25860e9b0652e5087cf5b96909376a,8f25860e,31,DNA,0,1000,3873,True,"GCF_016906005.1 Acinetobacter sp. 105-3 strain=105-3, ASM1690600v1",/dev/fd/63
signatures/c67751d6d1bfb14225923a836a6db091.sig.gz,c67751d6d1bfb14225923a836a6db091,c67751d6,31,DNA,0,1000,2841,True,"GCF_017973615.1 Staphylococcus aureus strain=SA-ME30, ASM1797361v1",/dev/fd/63
signatures/361c6b148e469c41d602662fc7dd3368.sig.gz,361c6b148e469c41d602662fc7dd3368,361c6b14,31,DNA,0,1000,4282,True,"GCF_017874915.1 Mesobacillus zeae strain=DSM 103964, ASM1787491v1",/dev/fd/63
signatures/40d6ccf2cc425aa1561f04be538d822f.sig.gz,40d6ccf2cc425aa1561f04be538d822f,40d6ccf2,31,DNA,0,1000,2852,True,"GCA_002296845.1 Bdellovibrionaceae bacterium UBA818, ASM229684v1",/dev/fd/63
signatures/3dded368fc1b91aa9d3389c1539ae035.sig.gz,3dded368fc1b91aa9d3389c1539ae035,3dded368,31,DNA,0,1000,2205,True,"GCA_002448655.1 Akkermansiaceae bacterium UBA6946, ASM244865v1",/dev/fd/63
signatures/d89b6e322cc0d9070f3612312a950c8d.sig.gz,d89b6e322cc0d9070f3612312a950c8d,d89b6e32,31,DNA,0,1000,5009,True,"GCF_002458625.1 Escherichia coli strain=MOD1-EC2396, ASM245862v1",/dev/fd/63
signatures/7cd0a0771eb5938d8e43abbd6d00f36c.sig.gz,7cd0a0771eb5938d8e43abbd6d00f36c,7cd0a077,31,DNA,0,1000,4697,True,"GCF_003572205.1 Rhodospirillaceae bacterium HHTR118 strain=HHTR118, ASM357220v1",/dev/fd/63
signatures/0c1a2405aa5f5ffdd808b1ca839692a0.sig.gz,0c1a2405aa5f5ffdd808b1ca839692a0,0c1a2405,31,DNA,0,1000,3912,True,"GCF_000302255.1 Acinetobacter baumannii AB_TG27343 strain=AB_TG27343, ASM30225v1",/dev/fd/63
signatures/d65273396e23afa7f731396822a02363.sig.gz,d65273396e23afa7f731396822a02363,d6527339,31,DNA,0,1000,3380,True,"GCA_903862935.1 uncultured Opitutaceae bacterium, freshwater MAG --- AlinenLipids_bin-8141",/dev/fd/63
signatures/f5177ab86cc2a25464853a0b89af44cf.sig.gz,f5177ab86cc2a25464853a0b89af44cf,f5177ab8,31,DNA,0,1000,4709,True,"GCF_009669545.1 Yersinia pestis strain=42126, ASM966954v1",/dev/fd/63
signatures/1818ee3e1650ebe96142f8d93d553a51.sig.gz,1818ee3e1650ebe96142f8d93d553a51,1818ee3e,31,DNA,0,1000,3977,True,"GCF_001286865.1 Bacillus subtilis, Bacillus JRS6",/dev/fd/63
signatures/e017ad906f2e625cac8401267211c792.sig.gz,e017ad906f2e625cac8401267211c792,e017ad90,31,DNA,0,1000,2178,True,"GCA_016292845.1 Frisingicoccus sp., ASM1629284v1",/dev/fd/63
signatures/a3e33394cd8b920788c72f78f80a64c0.sig.gz,a3e33394cd8b920788c72f78f80a64c0,a3e33394,31,DNA,0,1000,3871,True,"GCA_017853835.1 Pirellulales bacterium, ASM1785383v1",/dev/fd/63
signatures/8e34bd49fe1c17be9d5db7a63e43151a.sig.gz,8e34bd49fe1c17be9d5db7a63e43151a,8e34bd49,31,DNA,0,1000,2655,True,"GCA_003562335.1 PVC group bacterium, ASM356233v1",/dev/fd/63
signatures/aadc481db5d035cbc5a9def31e71fa5e.sig.gz,aadc481db5d035cbc5a9def31e71fa5e,aadc481d,31,DNA,0,1000,4725,True,"GCF_003689545.1 Salmonella enterica subsp. enterica serovar Typhi strain=OMJ 145, ASM368954v1",/dev/fd/63
signatures/05d6e940f57c66a401c942c2afa05127.sig.gz,05d6e940f57c66a401c942c2afa05127,05d6e940,31,DNA,0,1000,2805,True,"GCF_015883405.1 Listeria monocytogenes strain=112555, ASM1588340v1",/dev/fd/63
signatures/a37ca18d3334cef0141933862fe86321.sig.gz,a37ca18d3334cef0141933862fe86321,a37ca18d,31,DNA,0,1000,4967,True,"GCF_008033495.1 Escherichia coli strain=EC122, ASM803349v1",/dev/fd/63
signatures/68f95189dcdf7ef7142df24943a67003.sig.gz,68f95189dcdf7ef7142df24943a67003,68f95189,31,DNA,0,1000,6410,True,"GCF_000429625.1 Azospirillum halopraeferens DSM 3675 strain=DSM 3675, ASM42962v1",/dev/fd/63
signatures/d1fbc0c29b36bc9a5ae64b35be1a97bf.sig.gz,d1fbc0c29b36bc9a5ae64b35be1a97bf,d1fbc0c2,31,DNA,0,1000,8657,True,"GCF_019038455.1 Nocardia sp. ncl1 strain=ncl1, ASM1903845v1",/dev/fd/63
signatures/4a91615273f28d4028c39bbb777585d3.sig.gz,4a91615273f28d4028c39bbb777585d3,4a916152,31,DNA,0,1000,1204,True,"GCF_000265225.2 Rickettsia sp. MEAM1 (Bemisia tabaci) strain=MEAM1 (Bemisia tabaci), ASM26522v2",/dev/fd/63
signatures/f3c17a3409f65c58d1ea3c568c1189c0.sig.gz,f3c17a3409f65c58d1ea3c568c1189c0,f3c17a34,31,DNA,0,1000,2054,True,"GCA_902790005.1 uncultured Ruminococcus sp., Rumen uncultured genome RUG13527",/dev/fd/63
signatures/6310770409546060b89dd29c23394c14.sig.gz,6310770409546060b89dd29c23394c14,63107704,31,DNA,0,1000,5574,True,"GCA_900470115.1 Rhizobiales bacterium, AFS057993",/dev/fd/63
signatures/2f6e1faccb3dbd627b2102210d9a7226.sig.gz,2f6e1faccb3dbd627b2102210d9a7226,2f6e1fac,31,DNA,0,1000,2307,True,"GCA_003139055.1 Acidimicrobiaceae bacterium, 20110800_S1M",/dev/fd/63
signatures/947aede817029deb6051e598f36ba60f.sig.gz,947aede817029deb6051e598f36ba60f,947aede8,31,DNA,0,1000,5432,True,"GCF_904863225.1 Klebsiella pneumoniae, KSB1_6J",/dev/fd/63
signatures/965ef8a251399f3c09c55a51805bbb43.sig.gz,965ef8a251399f3c09c55a51805bbb43,965ef8a2,31,DNA,0,1000,2911,True,"GCF_001204195.1 Staphylococcus aureus strain=USFL239, 7738_3#52",/dev/fd/63
signatures/1788c85195e2835cdad435cd4f7efc74.sig.gz,1788c85195e2835cdad435cd4f7efc74,1788c851,31,DNA,0,1000,2743,True,"GCF_017329125.1 Staphylococcus aureus strain=I29, ASM1732912v1",/dev/fd/63
signatures/ef21b390222b0e803d63e300aea2b0ca.sig.gz,ef21b390222b0e803d63e300aea2b0ca,ef21b390,31,DNA,0,1000,665,True,"GCA_903833015.1 uncultured bacterium, freshwater MAG --- AM-lipid-02-D10_bin-0210",/dev/fd/63
signatures/4279e846bca829174a4e89965efd905c.sig.gz,4279e846bca829174a4e89965efd905c,4279e846,31,DNA,0,1000,2860,True,"GCF_003461585.1 Clostridium sp. AF15-6B strain=AF15-6B, ASM346158v1",/dev/fd/63
signatures/52bf5a23eb37c788698f8e84f8deae1b.sig.gz,52bf5a23eb37c788698f8e84f8deae1b,52bf5a23,31,DNA,0,1000,5682,True,"GCF_002411715.1 Klebsiella pneumoniae strain=183, ASM241171v1",/dev/fd/63
signatures/ecedf900a9a3e68b18aecbf6c7f1adad.sig.gz,ecedf900a9a3e68b18aecbf6c7f1adad,ecedf900,31,DNA,0,1000,4797,True,"GCF_006237865.1 Escherichia coli strain=EEPERB148, ASM623786v1",/dev/fd/63
signatures/77a883287ff0f666d4783dc32ebc796a.sig.gz,77a883287ff0f666d4783dc32ebc796a,77a88328,31,DNA,0,1000,1148,True,"GCA_002731355.1 Rhodospirillaceae bacterium, ASM273135v1",/dev/fd/63
signatures/c9954011c1b3b5d4567f586bff5943b8.sig.gz,c9954011c1b3b5d4567f586bff5943b8,c9954011,31,DNA,0,1000,6709,True,"GCF_900116595.1 Mesorhizobium sp. YR577 strain=YR577, IMG-taxon 2687453760 annotated assembly",/dev/fd/63
signatures/2cccde65179f37183c683643fbea0bb1.sig.gz,2cccde65179f37183c683643fbea0bb1,2cccde65,31,DNA,0,1000,4495,True,"GCF_002938435.1 Blastococcus saxobsidens strain=DSM 44509, ASM293843v1",/dev/fd/63
signatures/5e7affbe7a11bb772ef818e167040ea0.sig.gz,5e7affbe7a11bb772ef818e167040ea0,5e7affbe,31,DNA,0,1000,2161,True,"GCA_002421845.1 Epsilonproteobacteria bacterium UBA6211, ASM242184v1",/dev/fd/63
signatures/28961fd95c89d5102ed5c94bc639226d.sig.gz,28961fd95c89d5102ed5c94bc639226d,28961fd9,31,DNA,0,1000,4914,True,"GCF_005394825.1 Escherichia coli strain=NS-P056, ASM539482v1",/dev/fd/63
signatures/fb52c441feb397f9c921b84d47985bba.sig.gz,fb52c441feb397f9c921b84d47985bba,fb52c441,31,DNA,0,1000,2903,True,"GCA_903923465.1 uncultured Sphingomonadales bacterium, freshwater MAG --- AlinenLipids_bin-6204",/dev/fd/63
signatures/a7eff406c1a7a7e3cfe64097dcf95573.sig.gz,a7eff406c1a7a7e3cfe64097dcf95573,a7eff406,31,DNA,0,1000,5060,True,"GCF_002247945.1 Escherichia coli strain=ECH+05, ASM224794v1",/dev/fd/63
signatures/2e7a2adb16d59c28eb3f0253d9318975.sig.gz,2e7a2adb16d59c28eb3f0253d9318975,2e7a2adb,31,DNA,0,1000,5802,True,"GCF_003195895.1 Klebsiella pneumoniae strain=WUSM_KP_63, ASM319589v1",/dev/fd/63
signatures/855912d12ec0b8d59be4a1b4d54036aa.sig.gz,855912d12ec0b8d59be4a1b4d54036aa,855912d1,31,DNA,0,1000,1214,True,"GCA_000252525.1 SAR86 cluster bacterium SAR86A, SAR86A_1.0",/dev/fd/63
signatures/c6323d2ac920d5bec0e63b505f16432f.sig.gz,c6323d2ac920d5bec0e63b505f16432f,c6323d2a,31,DNA,0,1000,2802,True,"GCF_900035755.1 Staphylococcus aureus strain=st364, 7414_7#52",/dev/fd/63
signatures/a8e0c94536878679f8af4391a3f0d32b.sig.gz,a8e0c94536878679f8af4391a3f0d32b,a8e0c945,31,DNA,0,1000,2045,True,"GCF_001125645.1 Streptococcus pneumoniae strain=SMRU701, 6730_7#5",/dev/fd/63
signatures/992ebc740f545decaaae679359011970.sig.gz,992ebc740f545decaaae679359011970,992ebc74,31,DNA,0,1000,807,True,"GCA_903888715.1 Candidatus Adlerbacteria bacterium, freshwater MAG --- B12_bin-3186",/dev/fd/63
signatures/424a7d0a413d99e016688141b37c357a.sig.gz,424a7d0a413d99e016688141b37c357a,424a7d0a,31,DNA,0,1000,2100,True,"GCF_900029085.1 Neisseria meningitidis strain=2842STDY5881381, 14555_5#40",/dev/fd/63
signatures/3674a1b0d53dec3edcdc1a4dcc4befcb.sig.gz,3674a1b0d53dec3edcdc1a4dcc4befcb,3674a1b0,31,DNA,0,1000,1499,True,"GCA_905235795.1 uncultured Clostridia bacterium, RUG30277",/dev/fd/63
signatures/aadc04f0437b66b2e80d781d8563adc6.sig.gz,aadc04f0437b66b2e80d781d8563adc6,aadc04f0,31,DNA,0,1000,4966,True,"GCF_013412325.1 Salmonella enterica subsp. enterica serovar Typhimurium strain=B4381, ASM1341232v1",/dev/fd/63
signatures/ca26ee028814164eede40d4287d83fd2.sig.gz,ca26ee028814164eede40d4287d83fd2,ca26ee02,31,DNA,0,1000,4770,True,"GCF_002037285.1 Salmonella enterica subsp. enterica serovar 4,[5],12:r:- strain=SAL3276, ASM203728v1",/dev/fd/63
signatures/ba2be761034ecd178faa99a86795307e.sig.gz,ba2be761034ecd178faa99a86795307e,ba2be761,31,DNA,0,1000,3782,True,"GCA_003251795.1 Candidatus Muproteobacteria bacterium, ASM325179v1",/dev/fd/63
